{
  "version": 1,
  "title": "決済の Webhook で注文を確定させる変更を、シニアの目で読む",
  "base": "main",
  "head": "feature/webhook-receipts",
  "chapters": [
    {
      "title": "対象",
      "steps": [
        {
          "title": "読む変更とコミットメッセージ",
          "blocks": [
            {
              "target": true
            },
            {
              "quote": "注文確定の途中でタイムアウトすると、照合バッチが拾うまで最大 15 分ほど注文が決済中のまま残っていた。POST /webhooks/payment で charge.succeeded を受け取り、PENDING_PAYMENT の注文をすぐ PAID にする。\n- 同じイベントはイベント ID で 1 回だけ処理する。注文の更新が失敗したら記録せずに 500 を返し、決済サービスの送り直しに任せる\n- 課金の失敗では注文を変えず、これまでどおり照合バッチに判断を任せる"
            },
            {
              "p": "コミットは 2 つある。1 つ目で署名の検証とイベントの記録を作り、2 つ目で受け口と注文の確定をつないでいる。",
              "basis": "fact"
            },
            {
              "p": "シニアはまずメッセージの約束を覚えておく。特に「1 回だけ処理する」と「照合バッチに任せる」の 2 つは、コードで本当にそうなっているかをあとで確かめる。"
            }
          ]
        }
      ]
    },
    {
      "title": "何が変わったのか",
      "steps": [
        {
          "title": "これまでは、決済中のまま最大 15 分残っていた",
          "blocks": [
            {
              "code": {
                "file": "src/jobs/reconcilePendingPayments.ts",
                "at": "base",
                "lines": [
                  5,
                  6
                ],
                "show": [
                  5,
                  20
                ],
                "note": "変更なし"
              }
            },
            {
              "code": {
                "file": "src/server.ts",
                "at": "base",
                "lines": [
                  23,
                  25
                ],
                "note": "変更前"
              }
            },
            {
              "p": "照合バッチが拾うのは、更新から 10 分を過ぎた PENDING_PAYMENT の注文だけ。そのバッチが 5 分ごとに動くので、注文確定がタイムアウトした注文は最大 15 分ほど「決済中」のまま残る。コミットメッセージの「最大 15 分」は、この 2 つの数字から出ている。",
              "basis": "fact"
            },
            {
              "p": "変更後は、決済サービスから charge.succeeded が届いた時点で PAID になる。ユーザーから見ると、注文履歴が「決済中」から「支払い済み」に変わるまでの時間が短くなる。",
              "basis": "fact"
            }
          ]
        },
        {
          "title": "Webhook にどう答えるか",
          "blocks": [
            {
              "table": {
                "head": [
                  "状況",
                  "返す値",
                  "注文"
                ],
                "rows": [
                  [
                    "鍵（PAYMENT_WEBHOOK_SECRET）が未設定",
                    "503",
                    "変えない"
                  ],
                  [
                    "署名が合わない、時刻が 5 分を超えてずれている",
                    "401",
                    "変えない"
                  ],
                  [
                    "JSON として読めない、項目が足りない",
                    "400",
                    "変えない"
                  ],
                  [
                    "処理済みのイベント ID",
                    "200（duplicate）",
                    "変えない"
                  ],
                  [
                    "charge.succeeded で、注文が決済中",
                    "200",
                    "PAID にする"
                  ],
                  [
                    "charge.failed などそのほかのイベント",
                    "200",
                    "変えない"
                  ],
                  [
                    "注文の保存に失敗した",
                    "500",
                    "変えない（記録もしない）"
                  ],
                  [
                    "本文が 64KB を超える",
                    "413",
                    "変えない"
                  ]
                ]
              }
            },
            {
              "p": "ハンドラーのコメントには「2xx 以外を返すと決済サービスが送り直す」と書いてある。つまり、どれをエラーにするかは「もう一度送ってほしいか」の判断になる。",
              "basis": "fact"
            },
            {
              "p": "決済サービスが実際に送り直すかどうか、何回まで送り直すかは、このリポジトリからは確かめられない。この変更は、送り直してくれることを前提にしている。",
              "basis": "inferred"
            }
          ]
        }
      ]
    },
    {
      "title": "全体の地図",
      "steps": [
        {
          "title": "注文の状態を書き換える人が 3 人になった",
          "blocks": [
            {
              "table": {
                "head": [
                  "書き手",
                  "受け付ける状態",
                  "いつ",
                  "今回"
                ],
                "rows": [
                  [
                    "注文確定（OrderService）",
                    "CART / PAYMENT_FAILED",
                    "ボタンを押したとき",
                    "変更なし"
                  ],
                  [
                    "照合バッチ",
                    "10 分を過ぎた PENDING_PAYMENT",
                    "5 分ごと",
                    "変更なし"
                  ],
                  [
                    "Webhook",
                    "PENDING_PAYMENT（時間の条件なし）",
                    "通知が届いたとき",
                    "新しく追加"
                  ]
                ]
              }
            },
            {
              "code": {
                "file": "src/orders/orderService.ts",
                "at": "base",
                "lines": [
                  33,
                  40
                ],
                "show": [
                  31,
                  40
                ],
                "note": "変更なし"
              }
            },
            {
              "p": "注文確定は、決済中の注文を状態の確認で弾く。だから変更前は、10 分を過ぎた PENDING_PAYMENT を書き換えるのが照合バッチだけだった。どこにも書かれていないが、コードが守っていた約束になっている。",
              "basis": "fact"
            },
            {
              "p": "Webhook は時間の条件なしに PENDING_PAYMENT を書き換える。この約束にどう関わるかを、5 章で確かめる。",
              "basis": "fact"
            }
          ]
        },
        {
          "title": "1 本の Webhook がたどる道",
          "blocks": [
            {
              "pre": "POST /webhooks/payment\n └ server.ts  本文をバイト列のまま読む（64KB 超は 413）\n    └ handlePaymentWebhook\n       1. 鍵がない             → 503\n       2. 署名・時刻が合わない → 401\n       3. JSON が読めない      → 400\n       4. 処理済みのイベント   → 200 duplicate\n       5. charge.succeeded なら confirmCharge\n            PENDING_PAYMENT → PAID で保存\n            それ以外        → 何もしない（警告だけ）\n       6. イベントを記録       → 200\n    └ 例外 → 500（イベントは記録されない）"
            },
            {
              "code": {
                "file": "src/server.ts",
                "lines": [
                  26,
                  45
                ],
                "show": [
                  25,
                  47
                ]
              }
            },
            {
              "p": "Webhook の経路は checkout の振り分けより前に置かれ、処理が終わると必ず return する。checkout の正規表現と 404 の扱いはそのまま残っている。",
              "basis": "fact"
            }
          ]
        },
        {
          "title": "宣言が効く場所：マイグレーションと鍵",
          "blocks": [
            {
              "schema": {
                "migrations": "db/migrations",
                "tables": [
                  "payment_webhook_events"
                ]
              }
            },
            {
              "code": {
                "file": "src/db.ts",
                "lines": [
                  15,
                  26
                ],
                "note": "変更なし"
              }
            },
            {
              "p": "新しいテーブルは、SQL ファイルを置くだけで作られる。`openDatabase` が起動時に、まだ当てていないファイルを名前順に当てるから。テストも `openDatabase(':memory:')` を使うので、同じ仕組みでテーブルができる。",
              "basis": "fact"
            },
            {
              "diff": {
                "file": "src/app.ts",
                "hunks": [
                  1
                ]
              }
            },
            {
              "p": "鍵は環境変数から `app.ts` を経てハンドラーに渡る。既定値はない。設定し忘れると 503 になり、決済サービスが送り直すのを待つことになる。",
              "basis": "fact"
            }
          ]
        }
      ]
    },
    {
      "title": "仕組み",
      "steps": [
        {
          "title": "時間をかけて読むところと、流してよいところ",
          "blocks": [
            {
              "table": {
                "head": [
                  "ファイル",
                  "種類",
                  "確かめたこと"
                ],
                "rows": [
                  [
                    "src/handlers/paymentWebhook.ts",
                    "じっくり読む",
                    "状態の遷移、順番、エラーの返し方"
                  ],
                  [
                    "src/payment/webhookEventStore.ts",
                    "じっくり読む",
                    "重複の扱い"
                  ],
                  [
                    "src/payment/webhookSignature.ts",
                    "じっくり読む",
                    "検証の手順"
                  ],
                  [
                    "src/orders/order.ts",
                    "ほぼ機械的",
                    "paymentKeyFor の出力は同じ。逆向きの関数を追加"
                  ],
                  [
                    "src/app.ts / src/server.ts",
                    "機械的",
                    "組み立てと振り分けの追加だけ。checkout の経路は変わらない"
                  ],
                  [
                    "README.md",
                    "機械的",
                    "受け口と環境変数の説明"
                  ]
                ]
              }
            },
            {
              "diff": {
                "file": "src/orders/order.ts"
              }
            },
            {
              "p": "`paymentKeyFor` は接頭辞を定数にしただけで、出力は `order-<id>` のまま変わっていない。既存のテストは 1 行も書き換えられていない。",
              "basis": "fact"
            },
            {
              "p": "逆向きの関数を `paymentKeyFor` の隣に置き、同じ定数を使っている。冪等キーは「必ずここで作る」というコメントの決まりに沿った置き場所になっている。",
              "basis": "fact"
            }
          ]
        },
        {
          "title": "署名は、読んだバイト列そのものに対して確かめる",
          "blocks": [
            {
              "code": {
                "file": "src/payment/webhookSignature.ts",
                "lines": [
                  23,
                  31
                ],
                "show": [
                  21,
                  32
                ]
              }
            },
            {
              "code": {
                "file": "src/handlers/paymentWebhook.ts",
                "lines": [
                  34,
                  40
                ]
              }
            },
            {